{
  "date": "2026-01-02",
  "tasks": [],
  "completed": [
    {
      "content": "Phase 2監視定義をイベントベースに変更",
      "status": "completed",
      "category": "admin",
      "duration": "25m",
      "timestamp": "05:46",
      "memo": "v1.4-roadmap.mdに安定性監視の定義を追記。カレンダーベース→イベントベース（7回成功）に変更"
    }
  ],
  "carryover": [],
  "reflection": "",
  "tomorrow_candidates": [],
  "metadata": {
    "generated_at": "2026-01-01T20:46:59.171122+00:00",
    "source": "sync-digest-tasks",
    "version": "1.0.0",
    "updated_at": "2026-01-01T20:46:59.171325+00:00"
  }
}