{
  "date": "2026-01-04",
  "tasks": [],
  "completed": [
    {
      "content": "Phase 3ゲート条件クリア作業",
      "status": "completed",
      "category": "admin",
      "duration": "10m",
      "timestamp": "12:53",
      "memo": "Gate 2/5を4/5に到達させる運用タスク"
    }
  ],
  "carryover": [],
  "reflection": "",
  "tomorrow_candidates": [],
  "metadata": {
    "generated_at": "2026-01-04T03:53:38.794329+00:00",
    "source": "sync-digest-tasks",
    "version": "1.0.0",
    "updated_at": "2026-01-04T03:53:38.794570+00:00"
  }
}