{
  "date": "2025-11-19",
  "tasks": [
    {
      "content": "Cortex OS Weekly テスト",
      "status": "pending",
      "tags": [],
      "emoji": "",
      "category": "",
      "estimate": 1
    },
    {
      "content": "Recipe 11 動作確認",
      "status": "pending",
      "tags": [],
      "emoji": "",
      "category": "",
      "estimate": 1
    },
    {
      "content": "Continue On Fail 設定追加",
      "status": "pending",
      "tags": [],
      "emoji": "",
      "category": "",
      "estimate": 1
    }
  ],
  "completed": [],
  "carryover": [],
  "reflection": "- Weekly Summary のテスト用に作成\n- Phase 2.1 自動化基盤の検証中",
  "tomorrow_candidates": [],
  "metadata": {
    "generated_at": "2025-12-05T08:29:53.908Z",
    "source": "daily-digest",
    "version": "1.0.0"
  }
}